{
  "registryVersion": "1.0.0",
  "agents": [
    {
      "name": "unit-test-reviewer",
      "version": "1.0.0",
      "enabled": true,
      "promptFile": ".github/adversarial-agents/unit-test-reviewer/prompt.md",
      "promptVersion": "1.0.0",
      "promptContentHash": "6d36a3aa7798b5a56342befc1bfc2edc3d051b45a91183ff7f2ec4628ed26a9c",
      "modelDeployment": "gpt-4.1-mini@2025-04-14/eastus/GlobalStandard",
      "modelVersion": "2025-04-14",
      "toolsVersion": "1.0.0",
      "description": "Detects weak unit tests, missing edge cases, tautologies, and unsafe mocking patterns.",
      "targetScopes": ["tests"],
      "contactEmail": "dylan@microsoft.com",
      "verdictRules": {
        "blockingThreshold": 1,
        "allowHighConfidenceOnly": true
      },
      "executionConfig": {
        "maxConcurrentReviews": 3
      }
    }
  ],
  "subscriptionId": "11213dbd-39fe-46ba-87db-5f5e8c449aed",
  "requirementsMet": {
    "versionedJsonSchema": true,
    "dedicatedPromptFiles": true,
    "independentVersioning": true,
    "validationRequired": true,
    "agentRegistration": true
  }
}
