{
  "registryVersion": "1.0.0",
  "agents": [
    {
      "name": "unit-test-reviewer",
      "version": "1.0.0",
      "enabled": true,
      "promoted": true,
      "promptFile": ".github/adversarial-agents/unit-test-reviewer/prompt-v2.md",
      "promptVersion": "1.0.5",
      "promptContentHash": "9d5667c8233da813b06adc93eba7daf832339653b44c617a006df51b21697c68",
      "toolsConfigFile": "config/adversarial-agents/unit-test-reviewer/tools.json",
      "toolsConfigContentHash": "79a2f012bfe880863360ff59b5ede296095abb601cae47f03c293c54a8874998",
      "contextConfigFile": "config/adversarial-agents/shared-v2/context-collector.json",
      "contextConfigVersion": "1.0.1",
      "contextConfigContentHash": "07e048caf9224ef75c50f7f6b60d8796f53753d6ebbad65306d63ee2a27e1872",
      "schemaFile": "config/adversarial-agents/shared-v2/schema.json",
      "schemaContentHash": "cd46bbd7d12fd7b257c2ee24304f673a6a79ab13bda0696247ebc2b9313e375a",
      "policyFile": "config/adversarial-agents/shared-v2/policy.json",
      "policyContentHash": "ed7e5906234a69d282c2102490fc3227703c049c97e63170ffb968c34b478286",
      "engineConfigFile": "config/adversarial-agents/shared-v2/reviewer-engine.json",
      "engineConfigContentHash": "298a9eb95c8f20f5038505867ab6030add6432ea5ea8eeb430c8cc1c42672d3e",
      "benchmarkCorpusFile": "config/adversarial-agents/benchmarks.json",
      "benchmarkCorpusContentHash": "f065d4fb3f684815955fd522f34e5317305a0789c62c51f4da33b917a0c88531",
      "promotionPolicyFile": "config/adversarial-agents/promotion-policy.json",
      "promotionPolicyContentHash": "d834db90a3c08b065ee578b84cb3dd1bd40c20bafce2237b51e6c9a3dcfda2a5",
      "activeCalibrationReportFile": "config/adversarial-agents/shared-v2/active-calibration-unit-test-reviewer.json",
      "checkName": "Adversarial Review / unit-test-reviewer",
      "stateNamespace": "adversarial/unit-test-reviewer",
      "modelDeployment": "gpt-4.1-mini@2025-04-14/eastus/GlobalStandard",
      "modelVersion": "2025-04-14",
      "toolsVersion": "1.0.1",
      "description": "Detects weak unit tests, missing edge cases, tautologies, and unsafe mocking patterns.",
      "targetScopes": ["tests"],
      "contactEmail": "dylan@microsoft.com",
      "verdictRules": {
        "blockingThreshold": 1,
        "allowHighConfidenceOnly": true
      },
      "executionConfig": {
        "maxConcurrentReviews": 3
      }
    }
  ],
  "subscriptionId": "11213dbd-39fe-46ba-87db-5f5e8c449aed",
  "requirementsMet": {
    "versionedJsonSchema": true,
    "dedicatedPromptFiles": true,
    "independentVersioning": true,
    "validationRequired": true,
    "agentRegistration": true
  }
}
